{"assignments":{"cluster":[2,1,1,2,1,1,2,2,2,1,2,0,0,1,2,2,2,2,1,2,1,1,2,1,1,0,2,2,1,1,0,0,1,1,1,0,2,2,2,2,2,2,2,1,1,1,1,2,2,0,2,2,2,0,1,2,1,0,0,0,0,1,2,1,2,1,2,0,2,1,0,2,1,1,2,2,2,2,1,0,1,1,0,2,1,2,1,1,1,2,2,2,2,1,0,2,1,2,0,2,2,1,0,0,2,0,1,1,0,1,2,2,0,2,1,0,2,1,1,2,2,2,1,2,1,1,1,0,1,0,0,2,0,0,2,2,2,0,2,2,2,1,2,0,0,0,2,0,1,0,1,1,0,0,1,1,2,0,1,0,2,1,1,1,1],"iso3":["ABW","AGO","ALB","ARE","ARG","ARM","ATG","AUS","AUT","AZE","BEL","BEN","BFA","BGD","BGR","BHR","BHS","BIH","BLR","BLZ","BOL","BRA","BRN","BTN","BWA","CAF","CAN","CHE","CHL","CHN","CIV","CMR","COD","COG","COL","COM","CPV","CRI","CYP","CZE","DEU","DJI","DNK","DOM","DZA","ECU","EGY","ESP","EST","ETH","FIN","FJI","FRA","FSM","GAB","GBR","GEO","GHA","GIN","GMB","GNB","GNQ","GRC","GTM","HKG","HND","HRV","HTI","HUN","IDN","IND","IRL","IRN","IRQ","ISL","ISR","ITA","JPN","KAZ","KEN","KGZ","KHM","KIR","KOR","KWT","LBN","LBY","LKA","LSO","LTU","LUX","LVA","MAR","MDA","MDG","MDV","MEX","MKD","MLI","MLT","MNE","MNG","MOZ","MRT","MUS","MWI","MYS","NAM","NER","NIC","NLD","NOR","NPL","NZL","OMN","PAK","PAN","PER","PHL","PLW","POL","PRT","PRY","PSE","QAT","ROU","RUS","RWA","SAU","SDN","SEN","SGP","SLB","SLE","SLV","SMR","SRB","STP","SVK","SVN","SWE","SWZ","SYC","SYR","TCD","TGO","THA","TJK","TLS","TON","TUN","TUR","TZA","UGA","UKR","URY","USA","UZB","VNM","VUT","WSM","XKX","ZAF","ZMB","ZWE"],"silhouette":[0.4333,0.2189,-0.0142,0.1447,0.1357,0.1137,0.4159,0.1273,0.3834,0.2581,0.4264,0.3303,0.1828,0.0606,0.3312,0.1172,0.3511,0.3208,0.141,0.3179,0.2407,0.1365,0.0435,0.3448,0.2477,0.2903,0.3008,0.397,0.0608,0.2235,0.1204,0.0987,0.0436,0.1363,0.2192,0.3726,0.2692,0.1587,0.4339,0.2921,0.3696,0.1757,0.4576,0.2306,0.3416,0.1626,0.2717,0.3547,0.3185,0.257,0.3869,0.0805,0.3907,0.1095,0.2209,0.3129,0.0536,-0.0049,0.1267,0.3179,0.3944,0.0468,0.3448,0.2252,0.3217,0.2283,0.4414,0.0786,0.2776,0.2893,0.0434,0.1718,0.2422,0.2429,0.2531,0.2694,0.338,0.1859,0.2963,0.2748,0.1964,0.1495,0.2694,0.1391,0.1217,0.1376,0.2565,0.3482,0.1316,0.2988,0.3379,0.3921,0.0392,0.1366,0.2994,0.174,0.111,0.3364,0.3252,0.2809,0.3459,0.2839,0.2636,-0.0092,0.2835,0.2924,0.017,0.2145,0.3902,0.1545,0.4314,0.1812,0.3214,0.2448,0.028,0.2356,0.1045,0.3003,0.2778,0.3119,0.1876,0.4303,0.3335,0.099,0.0712,-0.0325,0.2041,0.3128,0.1639,0.0843,0.0717,0.2947,0.3554,0.3615,0.1913,0.2582,0.1174,0.095,0.3123,0.3679,0.4256,0.3104,0.2936,0.1126,0.322,0.2558,0.139,0.1043,0.1559,0.0414,0.0653,0.276,0.3026,0.2989,0.0313,0.1234,0.1078,0.0857,0.1672,0.2748,0.1762,0.046,0.1026,0.292,0.102]},"choice_rule":"Among k = 3..6 (k = 2 only re-draws the rich/poor line), keep k with min cluster size >= 5 and mean seed ARI >= 0.8; choose the highest silhouette. Rule satisfied.","chosen_k":3,"clusters":[{"centroid":{"agr_share":25.013,"growth":3.845,"ind_share":20.442,"infl_asinh":2.21,"ln_gdppc_ppp":8.123,"ln_trade":3.935},"centroid_z":{"agr_share":1.541,"growth":0.381,"ind_share":-0.518,"infl_asinh":0.475,"ln_gdppc_ppp":-1.306,"ln_trade":-0.744},"id":0,"members":["BEN","BFA","CAF","CIV","CMR","COM","ETH","FSM","GHA","GIN","GMB","GNB","HTI","IND","KEN","KIR","MDG","MLI","MOZ","MRT","MWI","NER","NPL","PAK","RWA","SDN","SEN","SLB","SLE","STP","SYR","TCD","TGO","TJK","TON","TZA","UGA","UZB","VUT"],"signature":"high agriculture share, low income level","size":39},{"centroid":{"agr_share":8.124,"growth":3.341,"ind_share":33.491,"infl_asinh":2.218,"ln_gdppc_ppp":9.583,"ln_trade":4.238},"centroid_z":{"agr_share":-0.197,"growth":0.13,"ind_share":0.728,"infl_asinh":0.485,"ln_gdppc_ppp":-0.012,"ln_trade":-0.194},"id":1,"members":["AGO","ALB","ARG","ARM","AZE","BGD","BLR","BOL","BRA","BTN","BWA","CHL","CHN","COD","COG","COL","DOM","DZA","ECU","EGY","GAB","GEO","GNQ","GTM","HND","IDN","IRN","IRQ","KAZ","KGZ","KHM","KWT","LBY","LKA","LSO","MDA","MEX","MNG","MYS","NAM","NIC","OMN","PER","PHL","PRY","QAT","ROU","RUS","SAU","SWZ","TLS","TUN","TUR","UKR","URY","VNM","XKX","ZAF","ZMB","ZWE"],"signature":"high industry share, high inflation","size":60},{"centroid":{"agr_share":2.929,"growth":2.394,"ind_share":22.137,"infl_asinh":1.293,"ln_gdppc_ppp":10.481,"ln_trade":4.685},"centroid_z":{"agr_share":-0.732,"growth":-0.343,"ind_share":-0.356,"infl_asinh":-0.722,"ln_gdppc_ppp":0.783,"ln_trade":0.616},"id":2,"members":["ABW","ARE","ATG","AUS","AUT","BEL","BGR","BHR","BHS","BIH","BLZ","BRN","CAN","CHE","CPV","CRI","CYP","CZE","DEU","DJI","DNK","ESP","EST","FIN","FJI","FRA","GBR","GRC","HKG","HRV","HUN","IRL","ISL","ISR","ITA","JPN","KOR","LBN","LTU","LUX","LVA","MAR","MDV","MKD","MLT","MNE","MUS","NLD","NOR","NZL","PAN","PLW","POL","PRT","PSE","SGP","SLV","SMR","SRB","SVK","SVN","SWE","SYC","THA","USA","WSM"],"signature":"high income level, low agriculture share","size":66}],"feature_window":{"growth":[2010,2023],"level":[2015,2023],"min_obs":5},"features":[{"id":"ln_gdppc_ppp","label":"Income level","mean":9.597329219061061,"price_basis":"ppp_constant_intl_2021","sd":1.1293507328448869,"source":"gdppc_ppp","transform":"mean of ln(GDP per capita, PPP) over the level window"},{"id":"growth","label":"Growth","mean":3.0811371962270573,"price_basis":null,"sd":2.003940578004344,"source":"gdp_growth","transform":"mean annual real GDP growth over the growth window"},{"id":"agr_share","label":"Agriculture share","mean":10.037620879430742,"price_basis":null,"sd":9.716719367999474,"source":"agr_share","transform":"mean agriculture value added, % of GDP"},{"id":"ind_share","label":"Industry share","mean":25.864911427259777,"price_basis":null,"sd":10.477178778078567,"source":"ind_share","transform":"mean industry value added, % of GDP"},{"id":"ln_trade","label":"Trade openness","mean":4.345307443256986,"price_basis":null,"sd":0.5519743566895142,"source":"trade_open","transform":"mean of ln(trade % of GDP)"},{"id":"infl_asinh","label":"Inflation","mean":1.8462197333970174,"price_basis":null,"sd":0.7663653014284305,"source":"inflation","transform":"asinh of the median CPI inflation (%) over the growth window"}],"hierarchical":{"ari_vs_kmeans":0.47818581010122085,"cophenetic_corr":0.48180968498719906,"disagree_count":37,"labels":[0,1,0,0,1,0,0,0,0,0,0,2,2,1,0,0,0,0,0,0,1,1,0,1,1,2,0,0,0,1,2,2,1,0,1,2,0,0,0,0,0,0,0,1,1,1,1,0,0,1,0,0,0,2,0,0,0,1,1,2,2,0,0,1,0,1,0,2,0,1,1,0,1,0,0,0,0,0,1,2,1,1,2,0,0,0,0,1,0,0,0,0,0,0,2,0,0,0,2,0,0,1,1,1,0,2,0,0,2,1,0,0,2,0,0,2,0,1,0,0,0,0,1,0,0,0,1,1,0,2,2,0,2,2,0,0,0,2,0,0,0,1,0,2,2,2,0,1,1,0,0,1,1,1,0,1,0,1,1,2,0,0,1,1,1],"labels_matched":[2,1,2,2,1,2,2,2,2,2,2,0,0,1,2,2,2,2,2,2,1,1,2,1,1,0,2,2,2,1,0,0,1,2,1,0,2,2,2,2,2,2,2,1,1,1,1,2,2,1,2,2,2,0,2,2,2,1,1,0,0,2,2,1,2,1,2,0,2,1,1,2,1,2,2,2,2,2,1,0,1,1,0,2,2,2,2,1,2,2,2,2,2,2,0,2,2,2,0,2,2,1,1,1,2,0,2,2,0,1,2,2,0,2,2,0,2,1,2,2,2,2,1,2,2,2,1,1,2,0,0,2,0,0,2,2,2,0,2,2,2,1,2,0,0,0,2,1,1,2,2,1,1,1,2,1,2,1,1,0,2,2,1,1,1],"leaf_order":["GNQ","COG","AZE","LBY","BRN","KWT","OMN","QAT","SAU","GAB","IRQ","DJI","MLT","MDV","SYC","ABW","CYP","HKG","LUX","ISL","MNE","MUS","SRB","BGR","LVA","BEL","NLD","SVK","CZE","SVN","LTU","EST","HUN","IRL","SGP","SMR","MYS","ARE","BHR","GRC","ITA","ESP","FRA","BHS","GBR","CHE","ATG","HRV","PRT","DEU","FIN","AUT","DNK","SWE","CHL","MEX","ROU","NOR","KOR","POL","JPN","USA","CAN","AUS","NZL","LSO","BLR","TUN","MDA","NAM","UKR","LBN","PLW","PAN","CRI","ISR","GEO","PHL","ARM","XKX","MAR","BIH","SLV","MKD","THA","BLZ","CPV","PSE","WSM","ALB","FJI","TON","ARG","AGO","IRN","BRA","URY","RUS","ZAF","TUR","BWA","KAZ","SWZ","BTN","PRY","DOM","PER","BOL","ECU","COL","GTM","EGY","DZA","LKA","MOZ","KGZ","HND","NIC","MRT","TLS","MNG","KHM","VNM","COD","ZMB","CHN","BGD","IND","IDN","ZWE","ETH","RWA","TZA","UGA","GHA","GIN","TJK","UZB","SDN","SYR","CAF","HTI","STP","PAK","KEN","NPL","GMB","MDG","MWI","SLE","BEN","KIR","CMR","CIV","SEN","BFA","TGO","FSM","VUT","SLB","COM","GNB","NER","MLI","TCD"],"linkage":"ward","match_rule":"Hungarian assignment of Ward groups to k-means ids maximising overlap; disagree_count = countries whose matched Ward id differs from their k-means id"},"inclusion":{"complete_cases":165,"countries":217,"excluded":[{"iso3":"AFG","missing":["ln_trade"]},{"iso3":"AND","missing":["ln_trade","infl_asinh"]},{"iso3":"ASM","missing":["ln_gdppc_ppp","agr_share","ind_share","infl_asinh"]},{"iso3":"BDI","missing":["ln_trade"]},{"iso3":"BMU","missing":["infl_asinh"]},{"iso3":"BRB","missing":["ln_trade"]},{"iso3":"CHI","missing":["ln_gdppc_ppp","ln_trade","infl_asinh"]},{"iso3":"CUB","missing":["ln_gdppc_ppp","infl_asinh"]},{"iso3":"CUW","missing":["ln_trade"]},{"iso3":"CYM","missing":["ln_trade"]},{"iso3":"DMA","missing":["ln_trade"]},{"iso3":"ERI","missing":["ln_gdppc_ppp","growth","agr_share","ind_share","ln_trade","infl_asinh"]},{"iso3":"FRO","missing":["infl_asinh"]},{"iso3":"GIB","missing":["ln_gdppc_ppp","growth","agr_share","ind_share","ln_trade","infl_asinh"]},{"iso3":"GRD","missing":["ln_trade"]},{"iso3":"GRL","missing":["infl_asinh"]},{"iso3":"GUM","missing":["ln_gdppc_ppp","agr_share","ind_share","infl_asinh"]},{"iso3":"GUY","missing":["ln_trade"]},{"iso3":"IMN","missing":["ln_gdppc_ppp","ln_trade","infl_asinh"]},{"iso3":"JAM","missing":["ln_trade"]},{"iso3":"JOR","missing":["ln_trade"]},{"iso3":"KNA","missing":["ln_trade"]},{"iso3":"LAO","missing":["ln_trade"]},{"iso3":"LBR","missing":["ln_trade"]},{"iso3":"LCA","missing":["ln_trade"]},{"iso3":"LIE","missing":["ln_gdppc_ppp","growth","ln_trade","infl_asinh"]},{"iso3":"MAC","missing":["agr_share"]},{"iso3":"MAF","missing":["ln_gdppc_ppp","agr_share","ind_share","ln_trade","infl_asinh"]},{"iso3":"MCO","missing":["ln_gdppc_ppp","agr_share","ln_trade","infl_asinh"]},{"iso3":"MHL","missing":["infl_asinh"]},{"iso3":"MMR","missing":["ln_trade"]},{"iso3":"MNP","missing":["ln_gdppc_ppp","agr_share","ind_share","infl_asinh"]},{"iso3":"NCL","missing":["ln_gdppc_ppp","agr_share","ind_share"]},{"iso3":"NGA","missing":["ln_trade"]},{"iso3":"NRU","missing":["agr_share","ind_share","infl_asinh"]},{"iso3":"PNG","missing":["ln_trade"]},{"iso3":"PRI","missing":["infl_asinh"]},{"iso3":"PRK","missing":["ln_gdppc_ppp","growth","agr_share","